{
	"id" : "dodsstjarnan",
	"main" : {
		"title" : "Förstör Dödsstjärnan",
		"background" : "Imperiet har länge slipat på sitt senaste, inte så lite farliga vapen; Dödsstjärnan. Nu står deras verk inför fullbordans rand. Inom en inte alltför lång tid kommer kejsaren ge order till sina horder att inviga detta vapen genom att bjuda en slumpmässigt vald oskyldig planet på en hejdundrande fyrverkerishow.",
		"goal" : "nØllan måste finna Dödsstjärnan och oskadliggöra denna. Eftersom nØllan nu har koden till kraftfältet borde det bli en enkel (jo, eller hur...) sak att förstöra Dödsstjärnan i triljoner bitar.",
		"reward" : "nØllans belöning kommer vara, förutom evig ära och berömmelse, en snabb placering som minst sist i Hurry Scurryn.",
		"hint" : "Det stora slaget närmar sig med stormsteg. Lyssna noga på rebellagentens instruktioner. Lycka till!"
	},
	"clues" : [],
	"meta" : {
		"resolution" : "nØllan får lines av rebellagenten och leds sedan till Millespottan för en duell med Darth Vader inför alla andra nØllan. Slår på pinata, får godis. Slut.",
		"requirements" : "Uppdraget behöver inte redovisas. nØllan har kommit minst sist!",
		"props" : "Dödsstjärnan är en piñata som nØllan slår sönder med vapnet som är ett Jesper Brännbollsträ."
	}
}
