{
	"id" : "solo",
	"main" : {
		"title" : "Befria Han Solo",
		"background" : "Han Solo är skyldig rymdfettot Jabba the Hutt en stor summa pengar. Detta har gjort honom väldigt efterlyst och numera väldigt försvunnen. Leias intensiva uppvaktning har lämnat honom helt kall. Han Solo är den enda som kan flyga Falken och ni måste hitta honom innan den fasansfulla Jabba the Hutt schlemar ner honom.",
		"goal" : "nØllan måste hitta Han Solo snabbt. (nØllan hinner dock säkert ta sig en Hutt innan nØllan träffar Jabba)",
		"reward" : "Detta uppdrag är värt 1600 krediter och dessutom Han Solos eviga tacksamhet.",
		"hint" : "Som mekaniker får man ofta höra ett och annat när rymdskepp kommer in för reparation efter något storartat äventyr. Snacka med Deppo som håller till i Junkfort Station i närheten av Nar Shaada, och se om han har någon aning om var Han kan ha tagit vägen."
	},
	"clues" : [
		{
			"id" : "1",
			"text" : "Jag vet inte var Han Solo hålls fången, men jag har hört rykten om att det krävs en hemlig kod för att komma in i cellen. Om ni hittar koden kanske ni även kommer över cellens position. Leta reda på Luke, och fråga om han har koll på när Han Solo hade sin svensexa, jag tror att det datumet kan vara den första delen av koden. Ni hittar honom i hålet vid Wild Space.",
			"comment" : "Ledtråden ges av Deppo om man frågar om Han Solo.",
			"characters" : []
		},
		{
			"id" : "2",
			"text" : "När nØllan kommer förbi och frågar om svensexan känner du nostalgi kring den, men känner dig lite väl ledsen över att Han är borta för att kunna den där koden som nØllan vill ha till Han Solos fängelse. När nØllan ger dig en tillräckligt bra komplimang skiner du upp ger ut koden 750 samt att Boba Fett i Wild Space vet mer. KOM IHÅG DEN KODEN!!",
			"comment" : "Efter komplimangen ger Luke det rätta svaret (750).",
			"characters" : []
		},
		{
			"id" : "3",
			"text" : "Svensexa. Juste, vi drog till Ice-bar! Jarjar och Joe Exotic drog hem tidigt, klena som de är. Luke hittade en riktigt snygg wookiebrud och drog hem, så det var bara jag och Han Solo kvar. Sen fastnade Han Solo med tungan på en vägg. Så jag gick hem, ingen har sett honom sedan dess. Konstigt. Ni kan hitta Ice-bar, som också går under namnet Cryochamber 5, i Corellia System.",
			"comment" : "Ges av Boba Fett som börjar prata om svensexan när de nämner svensexan och mutar honom med 500 krediter.",
			"characters" : []
		}
	],
	"meta" : {
		"resolution" : "När nØllan kommer till Cryo-chamber 5 frågar vakterna om koden (750). Vid korrekt kod klagar vakten på att det är så tråkigt att vakta den nedfrysta Han Solo. Hen deklarerar sedan att nØllan först måste podrace:a med hen innan de kan bli insläppta till Han Solo. Vakten tar då med nØllan ut till parkeringen utanför D-huset (gå ut genom utgången vid Örådet) och race:ar med sparkcyklarna. Efter racet återvänder de till Cryochamber 5 och inne i rummet står en stor frysbox innehållandes 13 stycken isblock. Vakten ser till att nØllan bara tar ett av dessa. I isblocken ligger »Frysvara»-lappar  varav en är den riktiga Han Solo och de andra 12 Han Solos bröder istället. När nØllan valt isblock tinar de upp det till exempel genom att spola varmt vatten på det inne på närmaste toalett. Han Solo är befriad.",
		"requirements" : "Uppdraget redovisas genom att laget går till Rebellbasen med med den Solo-broder som de tinade upp och visar upp honom. Om det är Han Solo så kan nØllan inkassera hela belöningen på 1600 krediter, men om det inte är han så får nØllan bara 1200.",
		"props" : "På det här uppdraget behövs en del saker som tar lite tid att fixa. Det behövs en vakt till dörren som kan släppa in nØllan, samt innehar två sparkcyklar. Inuti rummet skall det stå en frysbox och i den skall det finnas 13 stycken isblock med Solo-bröder. Isblocken tillverkas enkelt genom att fylla ett matlådor till hälften med vatten eller ännu hellre saft (det kan gå att läsa texten genom vatten), frysa, lägga i en Solo, fylla resten av paketet och till sist frysa det nya vattnet. Processen kan ta något dygn eller två så det är bra att börja i tid. Solo-bröderna utgörs av 13 stycken lappar märkta med »Frysvara» för Han Solo och hans bröder Hans Olof, Jan Solo, Lots Todo, Hans Aaro, Hen Solo, Han Solveig, Dan Solo, San Holo och Olos Nah, Fan Yolo, Steve Polo och Khan Jell-O. Lapparna finns som i mappen »Frysvara» under »Trycksaker» i Hurry Scurry-mappen och bör plastas in annars blir de förstörda när de ska frysas in. Frysboxen skall vaktas av minst en person som ser till att nØllan bara väljer ett isblock och inte gör sig av med själva isen genom att till exempel kasta isblocket i väggen. Vidare krävs också att personen som spelar Boba Fett är informerad om vad han eller hon skall säga och på plats i Wild Space (se kartan), lika så gäller för Luke. Det behövs också handsprit till Han Solo vakten för när de ska racea"
	}
}
